{
  "schema_version": "1.0.0",
  "diagnostic_only": true,
  "candidate_id": "bentosaur_s40_r003",
  "candidate_label": "Bentosaur S40 R003 axis-QF winner",
  "coordinate_contract": {
    "front": "-Y",
    "character_left": "+X",
    "up": "+Z",
    "floor": {
      "value": 0.0,
      "tolerance": 0.00001
    },
    "mirror": {
      "axis": "+X",
      "plane": 0.0,
      "tolerance": 0.000001,
      "p95_max": 0.000001,
      "minimum_ratio": 0.999
    },
    "expected_bounds": {
      "X": {
        "min": -0.3351316154,
        "max": 0.3351316154,
        "tolerance": 0.000002
      },
      "Y": {
        "min": -0.4419375658,
        "max": 0.438406527,
        "tolerance": 0.000002
      },
      "Z": {
        "min": 0.0,
        "max": 0.999593854,
        "tolerance": 0.000002
      }
    },
    "orientation_probes": [
      {
        "name": "tail_projects_toward_back_positive_y",
        "selector": {
          "all": [
            {
              "axis": "+Y",
              "min": 0.08
            },
            {
              "axis": "+Z",
              "max": 0.45
            }
          ]
        },
        "projection_axis": "+Y",
        "expected_mean": {
          "min": 0.15
        }
      },
      {
        "name": "head_projects_toward_front_negative_y",
        "selector": {
          "all": [
            {
              "axis": "+Y",
              "max": -0.08
            },
            {
              "axis": "+Z",
              "min": 0.45
            }
          ]
        },
        "projection_axis": "-Y",
        "expected_mean": {
          "min": 0.15
        }
      }
    ]
  },
  "rig": {
    "scope": "Disposable biped-and-tail stress skeleton for topology and gross deformation screening. It has no animator controls, facial system, production constraints, corrective shapes, or authored production weights.",
    "naming": {
      "left_suffix": ".L",
      "right_suffix": ".R",
      "tail_prefix": "tail_"
    },
    "bones": {
      "root": {
        "head": [
          0.0,
          0.0,
          0.00061512
        ],
        "tail": [
          0.0,
          0.0,
          0.09061512
        ],
        "parent": null,
        "deform": false
      },
      "pelvis": {
        "head": [
          0.0,
          0.035,
          0.20561513
        ],
        "tail": [
          0.0,
          0.02,
          0.30561513
        ],
        "parent": "root"
      },
      "spine": {
        "head": [
          0.0,
          0.02,
          0.30561513
        ],
        "tail": [
          0.0,
          0.005,
          0.43061513
        ],
        "parent": "pelvis",
        "connected": true
      },
      "chest": {
        "head": [
          0.0,
          0.005,
          0.43061513
        ],
        "tail": [
          0.0,
          -0.015,
          0.58061516
        ],
        "parent": "spine",
        "connected": true
      },
      "neck": {
        "head": [
          0.0,
          -0.015,
          0.58061516
        ],
        "tail": [
          0.0,
          -0.03,
          0.6456151
        ],
        "parent": "chest",
        "connected": true
      },
      "head": {
        "head": [
          0.0,
          -0.03,
          0.6456151
        ],
        "tail": [
          0.0,
          -0.11,
          0.8956151
        ],
        "parent": "neck",
        "connected": true
      },
      "jaw_placeholder": {
        "head": [
          0.0,
          -0.205,
          0.68561512
        ],
        "tail": [
          0.0,
          -0.345,
          0.68561512
        ],
        "parent": "head",
        "deform": false
      },
      "upper_arm.L": {
        "head": [
          0.15,
          -0.055,
          0.47061512
        ],
        "tail": [
          0.205,
          -0.085,
          0.40061513
        ],
        "parent": "chest"
      },
      "forearm.L": {
        "head": [
          0.205,
          -0.085,
          0.40061513
        ],
        "tail": [
          0.275,
          -0.135,
          0.33561513
        ],
        "parent": "upper_arm.L",
        "connected": true
      },
      "hand.L": {
        "head": [
          0.275,
          -0.135,
          0.33561513
        ],
        "tail": [
          0.31,
          -0.195,
          0.32561511
        ],
        "parent": "forearm.L",
        "connected": true
      },
      "upper_arm.R": {
        "head": [
          -0.15,
          -0.055,
          0.47061512
        ],
        "tail": [
          -0.205,
          -0.085,
          0.40061513
        ],
        "parent": "chest"
      },
      "forearm.R": {
        "head": [
          -0.205,
          -0.085,
          0.40061513
        ],
        "tail": [
          -0.275,
          -0.135,
          0.33561513
        ],
        "parent": "upper_arm.R",
        "connected": true
      },
      "hand.R": {
        "head": [
          -0.275,
          -0.135,
          0.33561513
        ],
        "tail": [
          -0.31,
          -0.195,
          0.32561511
        ],
        "parent": "forearm.R",
        "connected": true
      },
      "thigh.L": {
        "head": [
          0.105,
          0.025,
          0.25561512
        ],
        "tail": [
          0.13,
          0.0,
          0.14561513
        ],
        "parent": "pelvis"
      },
      "shin.L": {
        "head": [
          0.13,
          0.0,
          0.14561513
        ],
        "tail": [
          0.14,
          -0.035,
          0.04061514
        ],
        "parent": "thigh.L",
        "connected": true
      },
      "foot.L": {
        "head": [
          0.14,
          -0.035,
          0.04061514
        ],
        "tail": [
          0.14,
          -0.16,
          0.02061513
        ],
        "parent": "shin.L",
        "connected": true
      },
      "thigh.R": {
        "head": [
          -0.105,
          0.025,
          0.25561512
        ],
        "tail": [
          -0.13,
          0.0,
          0.14561513
        ],
        "parent": "pelvis"
      },
      "shin.R": {
        "head": [
          -0.13,
          0.0,
          0.14561513
        ],
        "tail": [
          -0.14,
          -0.035,
          0.04061514
        ],
        "parent": "thigh.R",
        "connected": true
      },
      "foot.R": {
        "head": [
          -0.14,
          -0.035,
          0.04061514
        ],
        "tail": [
          -0.14,
          -0.16,
          0.02061513
        ],
        "parent": "shin.R",
        "connected": true
      },
      "tail_01": {
        "head": [
          0.0,
          0.075,
          0.23061514
        ],
        "tail": [
          0.0,
          0.15,
          0.18561512
        ],
        "parent": "pelvis"
      },
      "tail_02": {
        "head": [
          0.0,
          0.15,
          0.18561512
        ],
        "tail": [
          0.0,
          0.23,
          0.15061513
        ],
        "parent": "tail_01",
        "connected": true
      },
      "tail_03": {
        "head": [
          0.0,
          0.23,
          0.15061513
        ],
        "tail": [
          0.0,
          0.305,
          0.12561512
        ],
        "parent": "tail_02",
        "connected": true
      },
      "tail_04": {
        "head": [
          0.0,
          0.305,
          0.12561512
        ],
        "tail": [
          0.0,
          0.37,
          0.11561513
        ],
        "parent": "tail_03",
        "connected": true
      },
      "tail_05": {
        "head": [
          0.0,
          0.37,
          0.11561513
        ],
        "tail": [
          0.0,
          0.43,
          0.12561512
        ],
        "parent": "tail_04",
        "connected": true
      }
    }
  },
  "weights": {
    "mode": "automatic_then_one_bounded_cleanup",
    "max_influences": 4,
    "rigid_overrides": [
      {
        "name": "head_and_frill_rigid_mass",
        "bone": "head",
        "selector": {
          "any": [
            {
              "axis": "+Z",
              "min": 0.54
            },
            {
              "all": [
                {
                  "axis": "+Y",
                  "max": -0.17
                },
                {
                  "axis": "+Z",
                  "min": 0.47
                }
              ]
            }
          ]
        }
      }
    ],
    "cross_side_filter": {
      "axis": "+X",
      "dead_zone": 0.015,
      "positive_side_suffix": ".L",
      "negative_side_suffix": ".R"
    },
    "removal_rules": [
      {
        "name": "remove_tail_weights_outside_tail_core",
        "bone_prefix": "tail_",
        "when": {
          "any": [
            {
              "axis": "+Y",
              "max": 0.025
            },
            {
              "axis": "+Z",
              "min": 0.52
            }
          ]
        }
      }
    ],
    "fallback": "nearest_deform_bone",
    "polish_iterations": 0
  },
  "regions": {
    "space": "world",
    "ordered": [
      {
        "name": "tail",
        "selector": {
          "all": [
            {
              "axis": "+Y",
              "min": 0.105
            },
            {
              "axis": "+Z",
              "max": 0.41561513
            }
          ]
        }
      },
      {
        "name": "head_neck",
        "selector": {
          "axis": "+Z",
          "min": 0.62561513
        }
      },
      {
        "name": "arm_L",
        "selector": {
          "bounds": {
            "x": [
              0.165,
              null
            ],
            "z": [
              0.30061513,
              0.62061513
            ]
          }
        }
      },
      {
        "name": "arm_R",
        "selector": {
          "bounds": {
            "x": [
              null,
              -0.165
            ],
            "z": [
              0.30061513,
              0.62061513
            ]
          }
        }
      },
      {